[
  {
    "source_id": "cn-rental",
    "source_title": "住房租赁条例",
    "jurisdiction": "全国",
    "source_url": "https://www.beijing.gov.cn/zhengce/zhengcefagui/qtwj/202508/t20250826_4184615.html",
    "valid_until": null,
    "effective_from": "2025-09-15",
    "published_at": "2025-07-21",
    "topics": [
      "合同",
      "押金",
      "备案"
    ],
    "applicability": "适用于城镇国有土地上的住房租赁。先区分个人出租、转租企业和经纪机构，各类主体的义务不同。",
    "validity_basis": "页面发布日期字段为2025-07-21；国务院令落款为7月16日。第五十条明确2025-09-15施行，未列终止日期。",
    "required_markers": [
      "城镇国有土地上住房租赁活动",
      "2025年9月15日起施行"
    ]
  },
  {
    "source_id": "cn-civil",
    "source_title": "民法典租赁合同章",
    "jurisdiction": "全国",
    "source_url": "https://www.court.gov.cn/zixun/xiangqing/233181.html",
    "valid_until": null,
    "effective_from": null,
    "published_at": null,
    "topics": [
      "合同",
      "维修",
      "转租",
      "退租"
    ],
    "applicability": "核对原文适用主体、办理条件及最新修订；未知有效期不代表永久有效。"
  },
  {
    "source_id": "bj-rental",
    "source_title": "北京市住房租赁条例",
    "jurisdiction": "北京",
    "source_url": "https://www.beijing.gov.cn/zhengce/dfxfg/202208/t20220823_2797935.html",
    "valid_until": null,
    "effective_from": "2022-09-01",
    "published_at": "2022-05-25",
    "topics": [
      "租赁安全",
      "押金",
      "备案"
    ],
    "applicability": "适用于北京行政区域内的住房租赁；城市公有房屋、公共租赁住房除外。租赁企业的专项要求不可直接套用于个人房东。",
    "validity_basis": "人大公告落款为2022-05-25；公告及第七十五条明确2022-09-01施行。",
    "required_markers": [
      "公共租赁住房的租赁不适用本条例",
      "2022年9月1日起施行"
    ]
  },
  {
    "source_id": "bj-funds",
    "source_title": "北京市住房租赁押金托管和租金监管暂行办法",
    "jurisdiction": "北京",
    "source_url": "https://www.beijing.gov.cn/zhengce/zhengcefagui/202408/t20240801_3764440.html",
    "valid_until": null,
    "effective_from": "2024-10-01",
    "published_at": "2024-07-31",
    "topics": [
      "押金",
      "租金监管"
    ],
    "applicability": "针对在北京承租他人住房从事转租业务的住房租赁企业；个人房东直租不直接套用。保租房资金另有规定时从其规定。",
    "validity_basis": "页面发布日期为2024-07-31，成文日期为7月29日；第二十二条明确2024-10-01施行。",
    "required_markers": [
      "承租他人住房从事转租业务",
      "2024年10月1日起施行"
    ]
  },
  {
    "source_id": "bj-pay",
    "source_title": "押金托管和租金监管资金缴纳操作详解",
    "jurisdiction": "北京",
    "source_url": "https://gjj.beijing.gov.cn/web/zwfw5/386727/543413441/543413444/543423007/index.html",
    "valid_until": null,
    "effective_from": null,
    "published_at": null,
    "topics": [
      "押金",
      "缴费"
    ],
    "applicability": "核对原文适用主体、办理条件及最新修订；未知有效期不代表永久有效。"
  },
  {
    "source_id": "bj-balance",
    "source_title": "租押金余额查询操作详解",
    "jurisdiction": "北京",
    "source_url": "https://gjj.beijing.gov.cn/web/zwfw5/386727/543413441/543413442/543423029/index.html",
    "valid_until": null,
    "effective_from": null,
    "published_at": null,
    "topics": [
      "押金",
      "资金查询"
    ],
    "applicability": "核对原文适用主体、办理条件及最新修订；未知有效期不代表永久有效。"
  },
  {
    "source_id": "bj-faq",
    "source_title": "租金监管常见问题解答",
    "jurisdiction": "北京",
    "source_url": "https://gjj.beijing.gov.cn/web/gjjhd/1747335/543413473/543425903/index.html",
    "valid_until": null,
    "effective_from": null,
    "published_at": null,
    "topics": [
      "租金监管",
      "办理条件"
    ],
    "applicability": "核对原文适用主体、办理条件及最新修订；未知有效期不代表永久有效。"
  },
  {
    "source_id": "bj-contract",
    "source_title": "北京市住房租赁合同2023",
    "jurisdiction": "北京",
    "source_url": "https://scjgj.beijing.gov.cn/bsfw/bmfw/sfwbbm/shxfl/fw/202303/t20230316_2937800.html",
    "valid_until": null,
    "effective_from": null,
    "published_at": null,
    "topics": [
      "合同",
      "交接"
    ],
    "applicability": "核对原文适用主体、办理条件及最新修订；未知有效期不代表永久有效。"
  },
  {
    "source_id": "bj-benefits",
    "source_title": "住房租赁合同备案公共服务",
    "jurisdiction": "北京",
    "source_url": "https://zjw.beijing.gov.cn/bjjs/fwzlfw84/wsczr/cjwd44/744029795/index.shtml",
    "valid_until": null,
    "effective_from": null,
    "published_at": null,
    "topics": [
      "备案",
      "公共服务"
    ],
    "applicability": "核对原文适用主体、办理条件及最新修订；未知有效期不代表永久有效。"
  },
  {
    "source_id": "bj-withdraw",
    "source_title": "租住商品住房提取住房公积金",
    "jurisdiction": "北京",
    "source_url": "https://www.beijing.gov.cn/fuwu/bmfw/bmzt/bjszfgjjtqzn/blzn/zftq/202306/t20230606_3124915.html",
    "valid_until": null,
    "effective_from": null,
    "published_at": null,
    "topics": [
      "公积金",
      "租房提取"
    ],
    "applicability": "核对原文适用主体、办理条件及最新修订；未知有效期不代表永久有效。"
  },
  {
    "source_id": "sh-rental",
    "source_title": "上海市住房租赁条例",
    "jurisdiction": "上海",
    "source_url": "https://www.shanghai.gov.cn/bzxzlzfjbzcsjzc/20230418/8a0798aa5f444182a33065910f5b272c.html",
    "valid_until": null,
    "effective_from": "2023-02-01",
    "published_at": "2022-11-23",
    "topics": [
      "合同",
      "维修",
      "备案"
    ],
    "applicability": "适用于上海行政区域内的住房租赁。执行时区分一般出租与租赁经营，保障性住房等另有规定的事项需另行核对。",
    "validity_basis": "人大公告与印发日期均为2022-11-23；公告及第六十六条明确2023-02-01施行。",
    "required_markers": [
      "2023年2月1日起施行"
    ]
  },
  {
    "source_id": "sh-platform",
    "source_title": "上海市住房租赁公共服务平台管理规定",
    "jurisdiction": "上海",
    "source_url": "https://service.shanghai.gov.cn/XingZhengWenDangKuJyh/XZGFDetails.aspx?docid=230822190535YHMGuhyEABsga4mziu5",
    "valid_until": "2028-06-30",
    "effective_from": "2023-09-01",
    "published_at": "2023-08-10",
    "topics": [
      "备案",
      "企业核验"
    ],
    "applicability": "适用于上海住房租赁公共服务平台的机构备案、合同网签备案及服务。平台信息不保证具体房屋或交易安全。",
    "validity_basis": "官方数据库公布日期为2023-08-10；第十三条规定2023-09-01施行，有效期至2028-06-30。",
    "required_markers": [
      "2023年9月1日起施行",
      "2028年6月30日"
    ]
  },
  {
    "source_id": "sh-withdraw",
    "source_title": "上海市住房公积金提取管理办法",
    "jurisdiction": "上海",
    "source_url": "https://www.shanghai.gov.cn/qyzfgjjsjzc/20240927/70392c98a8304968a46e8bb62b062f25.html",
    "valid_until": "2028-03-31",
    "effective_from": "2023-04-01",
    "published_at": "2023-03-31",
    "topics": [
      "公积金",
      "租房提取"
    ],
    "applicability": "适用于上海公积金提取管理。租房提取需核对无房、自住等条件，具体额度和材料还需查询对应住房类型的最新办事规则。",
    "validity_basis": "文件印发日期为2023-03-31；第五十条规定2023-04-01施行、有效期五年，目录据此按五周年前一日记录截止日2028-03-31。",
    "required_markers": [
      "2023年4月1日起施行",
      "有效期五年"
    ]
  },
  {
    "source_id": "gz-tips",
    "source_title": "广州市住房租赁温馨提示2026",
    "jurisdiction": "广州",
    "source_url": "https://zfcj.gz.gov.cn/zjdt/zjxw/content/mpost_10716254.html",
    "valid_until": null,
    "effective_from": null,
    "published_at": null,
    "topics": [
      "看房核验",
      "付款",
      "合同"
    ],
    "applicability": "核对原文适用主体、办理条件及最新修订；未知有效期不代表永久有效。"
  },
  {
    "source_id": "gz-rental",
    "source_title": "广州市关于规范住房租赁市场的通知",
    "jurisdiction": "广州",
    "source_url": "https://www.gz.gov.cn/zwgk/gzsrmzfgbn/2022/18/content/mpost_10640003.html",
    "valid_until": "2027-04-09",
    "effective_from": "2022-04-10",
    "published_at": "2022-04-12",
    "topics": [
      "租金监管",
      "押金"
    ],
    "applicability": "针对广州住房租赁从业主体经营。非自有住房、预收租金周期和押金金额影响监管要求，人才公寓、公租房等另有规定时从其规定。",
    "validity_basis": "页面发布日期2022-04-12；文件落款2022-04-10，第十项规定印发之日施行、有效期五年，目录据此记录2027-04-09为末日。",
    "required_markers": [
      "2022年4月10日",
      "有效期5年"
    ]
  },
  {
    "source_id": "sz-funds",
    "source_title": "深圳市住房租赁资金监管通知续期（2025年）",
    "jurisdiction": "深圳",
    "source_url": "https://zjj.sz.gov.cn/ztfw/zfbz/zcfg2017/content/post_12194734.html",
    "valid_until": "2027-06-11",
    "effective_from": null,
    "published_at": "2025-05-25",
    "topics": [
      "租金监管",
      "政策续期"
    ],
    "applicability": "本页仅证明深建规〔2021〕6号实体内容不变并续期至2027年6月11日。具体监管主体、金额和例外需另读原通知附件。",
    "validity_basis": "2025-05-25续期通知正文明确有效期延续至2027-06-11；本页未收录原通知PDF正文，不据此生成具体监管义务。",
    "required_markers": [
      "有效期延续至2027年6月11日"
    ]
  },
  {
    "source_id": "cn-tax",
    "source_title": "住房租金专项附加扣除热点问答",
    "jurisdiction": "全国",
    "source_url": "https://shanghai.chinatax.gov.cn/zcfw/rdwd/202603/t479656.html",
    "valid_until": null,
    "effective_from": null,
    "published_at": null,
    "topics": [
      "个税",
      "住房租金扣除"
    ],
    "applicability": "核对原文适用主体、办理条件及最新修订；未知有效期不代表永久有效。"
  },
  {
    "source_id": "cn-contract",
    "source_title": "城镇房屋租赁合同市场监管总局2025版",
    "jurisdiction": "全国",
    "source_url": "https://htsfwb.samr.gov.cn/View?id=2340996b-882d-47a4-b74d-c30784628737",
    "valid_until": null,
    "effective_from": null,
    "published_at": null,
    "topics": [
      "合同",
      "维修",
      "押金"
    ],
    "applicability": "核对原文适用主体、办理条件及最新修订；未知有效期不代表永久有效。"
  },
  {
    "source_id": "gz-gjj-extraction-rule",
    "source_title": "广州住房公积金管理中心关于印发广州市住房公积金提取管理办法的通知",
    "jurisdiction": "广州",
    "source_url": "https://www.gz.gov.cn/gfxwj/sbmgfxwj/gzzfgjjglzx/content/post_9443084.html",
    "published_at": "2023-12-25",
    "valid_until": "2028-12-31",
    "topics": [
      "公积金",
      "租房提取",
      "无房条件",
      "租赁备案",
      "多子女家庭"
    ],
    "effective_from": "2024-01-01",
    "applicability": "适用于广州住房公积金管理中心管辖范围。租房前提覆盖本人、配偶和未成年子女；未备案固定月额度由中心另行调整，本页不能单独证明当前固定金额。已备案提取仍有法定租金额度上限。",
    "source_kind": "official_publication",
    "required_markers": [
      "租赁合同未登记备案",
      "有效期5年"
    ]
  },
  {
    "source_id": "gz-lease-filing-guide",
    "source_title": "广州市房屋交易监管中心关于发布办理房屋租赁登记备案和存量房屋交易房源信息编码指引的通知",
    "jurisdiction": "广州",
    "source_url": "https://zfcj.gz.gov.cn/zwgk/zsdwwj/content/mpost_9477082.html",
    "published_at": "2024-02-02",
    "valid_until": null,
    "topics": [
      "租赁备案",
      "办理材料",
      "线上办理",
      "办事时限"
    ],
    "effective_from": null,
    "applicability": "采用正文附件1的租赁备案指引；附件2属于存量房买卖，不纳入租房摘要。办理平台入口和地区迁移可能另行更新，具体以主管部门现行入口与受理要求为准。 本指引列3个工作日，地方规定对材料齐全的备案要求当场办理；需分别归因并向受理部门核对，不能称为统一法定等待期。",
    "source_kind": "official_publication",
    "required_markers": [
      "3个工作日",
      "房屋合法来源资料"
    ]
  },
  {
    "source_id": "gz-lease-management-rule",
    "source_title": "广州市房屋租赁管理规定",
    "jurisdiction": "广州",